Sheet: основной
A1: LEFT CONTEXT | B1: CENTER | C1: PUNCT | D1: RIGHT CONTEXT | E1: TITLE | F1: AUTHOR | G1: BIRTHDAY | H1: HEADER | I1: CREATED | J1: SPHERE | K1: TYPE | L1: TOPIC | M1: PUBLICATION | N1: PUBL_YEAR | O1: MEDIUM | P1: AMBIGUITY | Q1: FULL CONTEXT | R1: RANDOM | S1: PREFIX | T1: TENSE | U1: PERSONNUMBER | V1: PARTICIPANT1 | W1: PARTICIPANT2 | X1: PARTICIPANT3(с кем) | Y1: PARTICIPANT4(чем)
A2: дойдет до того. Одного Никитина | B2: спутаем | C2: . | D2: Он уж не отвертится. | E2: К. П. Масальский. Черный ящик (1833) | F2: К. П. Масальский | G2: 1802 | H2: Черный ящик | I2: 1833 | J2: художественная | K2: повесть | M2: Предслава и Добрыня: Исторические повести русских романтиков | N2: 1986 | O2: книга | P2: омонимия не снята | Q2: Обследование буду производить я, если дойдет до того. Одного Никитина спутаем. Он уж не отвертится. [К. П. Масальский. Черный ящик (1833)] [омонимия не снята] | R2: =RAND() -> 0.66303197512218459 | S2: с | T2: Будущее | U2: 2л. мн.ч. | V2: человек | W2: человек | X2: NA | Y2: NA
A3: Сам дьявол взбудоражит вдруг подозрениями, | B3: спутает | D3: сроки, навеет бессмыслицу… | E3: О. Д. Форш. Михайловский замок (1946) | F3: О. Д. Форш | G3: 1873 | H3: Михайловский замок | I3: 1946 | J3: художественная | K3: роман | M3: О. Форш. Одеты камнем. Михайловский замок: Романы | N3: 1980 | O3: книга | P3: омонимия не снята | Q3: Сам дьявол взбудоражит вдруг подозрениями, спутает сроки, навеет бессмыслицу… [О. Д. Форш. Михайловский замок (1946)] [омонимия не снята] | R3: =RAND() -> 8.4921881181394987E-2 | S3: с | T3: Будущее | U3: 3л. ед.ч. | V3: дух | W3: абстрактный предмет | X3: NA | Y3: NA
A4: темы «Воспитание молодого воина» я | B4: спутал | D4: выражения «кригсшуле» с «милитэршуле». | E4: А. А. Игнатьев. Пятьдесят лет в строю. Кн. 1-2 (1947-1953) | F4: А. А. Игнатьев | G4: 1877 | H4: Пятьдесят лет в строю. Кн. 1-2 | I4: 1947-1953 | J4: публицистика , нехудожественная | K4: мемуары | M4: Игнатьев А. А. Пятьдесят лет в строю | N4: 1986 | O4: книга | P4: омонимия не снята | Q4: По немецкому языку мне сбавили один балл за то, что в изложении темы «Воспитание молодого воина» я спутал выражения «кригсшуле» с «милитэршуле». [А. А. Игнатьев. Пятьдесят лет в строю. Кн. 1-2 (1947-1953)] [омонимия не снята] | R4: =RAND() -> 0.77287251504453569 | S4: с | T4: Прошедшее | U4: ед.ч. м.р. | V4: человек | W4: абстрактный предмет | X4: NA | Y4: NA
A5: Но оказывается, В. не | B5: спутал | C5: , | D5: потому что он спрашивает: | E5: Л. Я. Гинзбург. Записные книжки. Воспоминания. Эссе (1920-1943) | F5: Л. Я. Гинзбург | G5: 1902 | H5: Записные книжки. Воспоминания. Эссе | I5: 1920-1943 | J5: публицистика , нехудожественная | K5: дневник, записные книжки | M5: Лидия Гинзбург. Записные книжки. Воспоминания. Эссе | N5: 2002 | O5: книга | P5: омонимия не снята | Q5: Но оказывается, В. не спутал, потому что он спрашивает: [Л. Я. Гинзбург. Записные книжки. Воспоминания. Эссе (1920-1943)] [омонимия не снята] | R5: =RAND() -> 0.64665957563163057 | S5: с | T5: Прошедшее | U5: ед.ч. м.р. | V5: человек | W5: NA | X5: NA | Y5: NA
A6: это он не признает, неужели | B6: спутал | C6: ?» | E6: А. М. Ремизов. Взвихренная Русь (1917-1924) | F6: А. М. Ремизов | G6: 1877 | H6: Взвихренная Русь | I6: 1917-1924 | J6: художественная , публицистика | K6: мемуары, рассказ | M6: Ремизов А. М. Взвихренная Русь | N6: 2002 | O6: книга | P6: омонимия не снята | Q6: И думаю: «Что же это он не признает, неужели спутал?» [А. М. Ремизов. Взвихренная Русь (1917-1924)] [омонимия не снята] | R6: =RAND() -> 0.23395484262707877 | S6: с | T6: Прошедшее | U6: ед.ч. м.р. | V6: человек | W6: NA | X6: NA | Y6: NA
A7: страстной, Залог души, любимой божеством… | B7: Спутал | C7: , | D7: забыл. Очень старо, но хорошо | E7: А. П. Платонов. Из писем (1922-1927) | F7: А. П. Платонов | G7: 1899 | H7: Из писем | I7: 1922-1927 | J7: публицистика , нехудожественная | K7: письмо личное | L7: частная жизнь | M7: Андрей Платонов. «Котлован». Избранная проза | N7: 1988 | O7: книга | P7: омонимия не снята | Q7: Любовь души, заброшенной и страстной, Залог души, любимой божеством… Спутал, забыл. Очень старо, но хорошо. [А. П. Платонов. Из писем (1922-1927)] [омонимия не снята] | R7: =RAND() -> 9.8240596728083274E-2 | S7: с | T7: Прошедшее | U7: ед.ч. м.р. | V7: NA | W7: NA | X7: NA | Y7: NA
A8: мемуариста слишком очевидна: он явно | B8: спутал | D8: и постановленія Исп. | E8: C. П. Мельгунов. Мартовскіе Дни 1917 года (1940-1954) | F8: С. П. Мельгунов | G8: 1879 | H8: Мартовскіе Дни 1917 года | I8: 1940-1954 | J8: публицистика, нехудожественная | K8: монография | L8: история, политика и общественная жизнь | M8: Личная библіотека B. Z. http://boomzoomer. livejournal.com | N8: 1961 | O8: книга | P8: омонимия не снята | Q8: Несуразица утвержденія мемуариста слишком очевидна: он явно спутал и постановленія Исп. [C. П. Мельгунов. Мартовскіе Дни 1917 года (1940-1954)] [омонимия не снята] | R8: =RAND() -> 0.7559143067043308 | S8: с | T8: Прошедшее | U8: ед.ч. м.р. | V8: человек | W8: абстрактный предмет | X8: NA | Y8: NA
A9: Но Н. Волковыский меня, очевидно, | B9: спутал | D9: с каким-нибудь другим, более заслуженным | E9: А. Л. Бем. Еще о Гумилеве // «Руль», 1931 | F9: А. Л. Бем | G9: 1886 | H9: Еще о Гумилеве | I9: 1931 | J9: публицистика , нехудожественная | K9: статья | L9: наука и технологии, филология | M9: «Руль» | N9: 1931 | O9: журнал | P9: омонимия не снята | Q9: Но Н. Волковыский меня, очевидно, спутал с каким-нибудь другим, более заслуженным литературным критиком. [А. Л. Бем. Еще о Гумилеве // «Руль», 1931] [омонимия не снята] | R9: =RAND() -> 0.10185841707719689 | S9: с | T9: Прошедшее | U9: ед.ч. м.р. | V9: человек | W9: человек | X9: человек | Y9: NA
A10: шкафе. ― Меня этот чортов трос | B10: спутал | C10: . | D10: Какому дураку пришло в голову | E10: А. И. Минеев. Пять лет на острове Врангеля (1936) | F10: А. И. Минеев | G10: 1900 | H10: Пять лет на острове Врангеля | I10: 1936 | J10: публицистика, нехудожественная | K10: монография | L10: путешествия | M10: А. И. Минеев. Пять лет на острове Врангеля | N10: 1936 | O10: книга | P10: омонимия не снята | Q10: Сбили вы меня с толку машиной, я и не подумал о шкафе. ― Меня этот чортов трос спутал. Какому дураку пришло в голову пеленать полуторадюймовым фалом пустой ящик! [А. И. Минеев. Пять лет на острове Врангеля (1936)] [омонимия не снята] | R10: =RAND() -> 0.53042868165611545 | S10: с | T10: Прошедшее | U10: ед.ч. м.р. | V10: неодушевленный конкретный предмет | W10: человек | X10: NA | Y10: NA
A11: досадой упрекнула Клима: ― Это ты | B11: спутал | D11: все… ― Он всегда суется вперед | E11: Максим Горький. Жизнь Клима Самгина. Часть 1 (1925) | F11: Максим Горький | G11: 1868 | H11: Жизнь Клима Самгина. Часть 1 | I11: 1925 | J11: художественная | K11: роман | M11: Горький М. Собр. соч.: В 30 т. Т. 19 | N11: 1953 | O11: книга | P11: омонимия не снята | Q11: Замолчала, прикрыв глаза, а потом с досадой упрекнула Клима: ― Это ты спутал все… ― Он всегда суется вперед всех, как слепой, ― сурово сказал Борис и начал подсказывать рифмы: [Максим Горький. Жизнь Клима Самгина. Часть 1 (1925)] [омонимия не снята] | R11: =RAND() -> 0.43445283426746129 | S11: с | T11: Прошедшее | U11: ед.ч. м.р. | V11: человек | W11: NA | X11: NA | Y11: NA
A12: твердо, ни одного выхода не | B12: спутал | C12: . | E12: Б. А. Садовской. Записки актера (1927) | F12: Б. А. Садовской | G12: 1881 | H12: Записки актера | I12: 1927 | J12: художественная | K12: повесть | M12: Садовской Б. А. Лебединые клики | N12: 1990 | O12: книга | P12: омонимия не снята | Q12: Роль я выучил великолепно, провел сцены твердо, ни одного выхода не спутал. [Б. А. Садовской. Записки актера (1927)] [омонимия не снята] | R12: =RAND() -> 0.44301353724018422 | S12: с | T12: Прошедшее | U12: ед.ч. м.р. | V12: NA | W12: NA | X12: NA | Y12: NA
A13: извини, может быть, я что-нибудь | B13: спутал | C13: , | D13: но у них тут пошел | E13: А. А. Бек. Талант (Жизнь Бережкова) / Части 1-3 (1940-1956) | F13: А. А. Бек | G13: 1903 | H13: Талант (Жизнь Бережкова) / Части 1-3 | I13: 1940-1956 | J13: художественная | K13: роман | M13: Бек А. Собрание сочинений. В 4-х томах. Волоколамское шоссе. Военные рассказы и очерки | N13: 1974 | O13: книга | P13: омонимия не снята | Q13: Федя, извини, может быть, я что-нибудь спутал, но у них тут пошел свой разговор о поясных и ростовых мишенях, о прицельных рамках, о дистанциях и так далее, словно у заправских пулеметчиков. [А. А. Бек. Талант (Жизнь Бережкова) / Части 1-3 (1940-1956)] [омонимия не снята] | R13: =RAND() -> 0.72390902232650489 | S13: с | T13: Прошедшее | U13: ед.ч. м.р. | V13: человек | W13: NA | X13: NA | Y13: NA
A14: Тут Тимофей | B14: спутал | D14: его знаменитого коня, который был | E14: А. А. Черкасов. Разбойник (1883-1887) | F14: А. А. Черкасов | G14: 1834 | H14: Разбойник | I14: 1883-1887 | J14: художественная | K14: рассказ | M14: Черкасов Александр. Из записок сибирского охотника. Иркутск: Восточно-Сибирское книжное издательство, 1987 | N14: 1987 | O14: книга | P14: омонимия не снята | Q14: Тут Тимофей спутал его знаменитого коня, который был оседлан и ел снопы овса, а я подошел к самому выходу из балагана, поставил на сошки свой дробовик и встал на одно коленко. [А. А. Черкасов. Разбойник (1883-1887)] [омонимия не снята] | R14: =RAND() -> 0.73398312908024954 | S14: с | T14: Прошедшее | U14: ед.ч. м.р. | V14: человек | W14: животное | X14: NA | Y14: NA
A15: на Антония с размаху, я | B15: спутал | D15: его в рясе, как паук | E15: В. Т. Нарежный. Российский Жилблаз, или Похождения князя Гаврилы Симоновича Чистякова (1814) | F15: В. Т. Нарежный | G15: 1780 | H15: Российский Жилблаз, или Похождения князя Гаврилы Симоновича Чистякова | I15: 1814 | J15: художественная | K15: роман | M15: В. Т. Нарежный. Собрание сочинений в 2 томах. Т.1 | N15: 1983 | O15: книга | P15: омонимия не снята | Q15: Тут, бросившись на Антония с размаху, я спутал его в рясе, как паук спутывает муху в паутине, и начал тормошить и терзать. [В. Т. Нарежный. Российский Жилблаз, или Похождения князя Гаврилы Симоновича Чистякова (1814)] [омонимия не снята] | R15: =RAND() -> 0.55101308807409222 | S15: с | T15: Прошедшее | U15: ед.ч. м.р. | V15: человек | W15: человек | X15: NA | Y15: NA
A16: вопросами и предположениями еще больше | B16: спутал | D16: Ивана Ильича и усилил его | E16: Л. Н. Толстой. Смерть Ивана Ильича (1886) | F16: Л. Н. Толстой | G16: 1828 | H16: Смерть Ивана Ильича | I16: 1886 | J16: художественная | K16: повесть | M16: Л. Н. Толстой. Собр. соч.: В 22 т. Т. 12 | N16: 1979 | O16: книга | P16: омонимия не снята | Q16: Приятель его приятеля ― доктор очень хороший ― тот еще совсем иначе определил болезнь и, несмотря на то, что обещал выздоровление, своими вопросами и предположениями еще больше спутал Ивана Ильича и усилил его сомнение. [Л. Н. Толстой. Смерть Ивана Ильича (1886)] [омонимия не снята] | R16: =RAND() -> 0.52705651783597851 | S16: с | T16: Прошедшее | U16: ед.ч. м.р. | V16: NA | W16: человек | X16: NA | Y16: абстрактный предмет
A17: смысл пьесы, но сатирик, очевидно, | B17: спутал | D17: Исава с похлебкою), можно ли | E17: М. Е. Салтыков-Щедрин. В сумерках. Сатиры и песни Д. Д. Минаева. СПб. 1868 г. (1868) | F17: М. Е. Салтыков-Щедрин | G17: 1826 | H17: В сумерках. Сатиры и песни Д. Д. Минаева. СПб. 1868 г. | I17: 1868 | J17: публицистика , нехудожественная | K17: рецензия | L17: политика и общественная жизнь | N17: 1970 | O17: книга | P17: омонимия не снята | Q17: Минаев, вероятно, хотел сказать, что поэт продал, подобно Исаву, свое первородство, взамен чечевичной похлебки на обедах (так, по крайней мере, гласит смысл пьесы, но сатирик, очевидно, спутал Исава с похлебкою), можно ли представить себе заключения более неожиданного, более несоответственного общему тону пьесы и в особенности начала ее? [М. Е. Салтыков-Щедрин. В сумерках. Сатиры и песни Д. Д. Минаева. СПб. 1868 г. (1868)] [омонимия не снята] | R17: =RAND() -> 7.4017006408284569E-3 | S17: с | T17: Прошедшее | U17: ед.ч. м.р. | V17: человек | W17: человек | X17: неодушевленный конкретный предмет
A18: Очевидно, дядя Федор плохо | B18: спутал | D18: им ноги. | E18: А. А. Богданов. На Ладоге (1900-1901) | F18: А. А. Богданов | G18: 1874 | H18: На Ладоге | I18: 1900-1901 | J18: художественная | K18: рассказ | M18: А. А. Богданов. Избранная проза | N18: 1960 | O18: книга | P18: омонимия не снята | Q18: Очевидно, дядя Федор плохо спутал им ноги. [А. А. Богданов. На Ладоге (1900-1901)] [омонимия не снята] | R18: =RAND() -> 0.14494114766156807 | S18: с | T18: Прошедшее | U18: ед.ч. м.р. | V18: человек | W18: NA | X18: NA | Y18: неодушевленный конкретный предмет
A19: Лештукова жаль. | B19: Спутала | D19: она его. Кистяковъ. | E19: А. В. Амфитеатров. Волны (В стране любви). Комедия в 4-х действиях (1903) | F19: А. В. Амфитеатров | G19: 1862 | H19: Волны (В стране любви). Комедия в 4-х действиях | I19: 1903 | J19: художественная | K19: пьеса | M19: Пять пьес. С. Петербург, 1908. Типография т-ва «Общественная Польза | N19: 1908 | O19: электронный текст | P19: омонимия не снята | Q19: Лештукова жаль. Спутала она его. Кистяковъ. [А. В. Амфитеатров. Волны (В стране любви). Комедия в 4-х действиях (1903)] [омонимия не снята] | R19: =RAND() -> 0.60892732434220398 | S19: с | T19: Прошедшее | U19: ед.ч. ж.р. | V19: человек | W19: человека | X19: NA | Y19: NA
A20: и чуждая обстановка сбила и | B20: спутала | D20: меня; но вскоре я привык | E20: Н. Цуриков. Дети эмиграции (1925) | F20: Н. Цуриков | H20: Дети эмиграции | I20: 1925 | J20: публицистика , нехудожественная | K20: статья, обзор | L20: политика и общественная жизнь | M20: Дети эмиграции. Воспоминания | N20: 2001 | O20: книга | P20: омонимия не снята | Q20: Первоначально незнакомая и чуждая обстановка сбила и спутала меня; но вскоре я привык… [Н. Цуриков. Дети эмиграции (1925)] [омонимия не снята] | R20: =RAND() -> 0.14968842799571835 | S20: с | T20: Прошедшее | U20: ед.ч. ж.р. | V20: абстрактный предмет | W20: человека | X20: NA | Y20: NA
A21: она, показывая старушке вязанье. ― Опять | B21: спутала | C21: ! | D21: ― отвечала та, подвигая на носу | E21: А. Ф. Писемский. Взбаламученное море (1863) | F21: А. Ф. Писемский | G21: 1821 | H21: Взбаламученное море | I21: 1863 | J21: художественная | K21: роман | M21: А. Ф. Писемский. Собрание сочинений | N21: 1910 | O21: книга | P21: омонимия не снята | Q21: ― сказала она, показывая старушке вязанье. ― Опять спутала! ― отвечала та, подвигая на носу очки ближе к глазам. [А. Ф. Писемский. Взбаламученное море (1863)] [омонимия не снята] | R21: =RAND() -> 0.81365721827396376 | S21: с | T21: Прошедшее | U21: ед.ч. ж.р. | V21: человек | W21: NA | X21: NA | Y21: NA
A22: После этого они | B22: спутали | D22: своих лошадей и, привязав их | E22: Н. А. Дурова. Кавалерист-девица (1835) | F22: Н. А. Дурова | G22: 1783 | H22: Кавалерист-девица | I22: 1835 | J22: публицистика , нехудожественная | K22: мемуары | M22: Избранные произведения кавалерист-девицы Н. А. Дуровой | N22: 1983 | O22: книга | P22: омонимия не снята | Q22: После этого они спутали своих лошадей и, привязав их на арканы, обмотали концами их каждый свою руку и легли спать. [Н. А. Дурова. Кавалерист-девица (1835)] [омонимия не снята] | R22: =RAND() -> 0.85503473638656413 | S22: с | T22: Прошедшее | U22: мн.ч. | V22: человек | W22: животное | X22: NA | Y22: NA
A23: Руки и ноги юноши | B23: спутали | D23: крепкие ремни. | E23: И. А. Ефремов. На краю Ойкумены (1945-1946) | F23: И. А. Ефремов | G23: 1908 | H23: На краю Ойкумены | I23: 1945-1946 | J23: художественная | K23: роман | M23: Иван Ефремов. Собрание сочинений: В 5 т. Том 5. Книга 1 М.: Молодая гвардия, 1989 | N23: 1989 | O23: книга | P23: омонимия не снята | Q23: Руки и ноги юноши спутали крепкие ремни. [И. А. Ефремов. На краю Ойкумены (1945-1946)] [омонимия не снята] | R23: =RAND() -> 0.39937227759674887 | S23: с | T23: Прошедшее | U23: мн.ч. | V23: неодушевленный конкретный предмет | W23: часть тела человека | X23: NA | Y23: NA
A24: живых бы с покойниками не | B24: спутали | C24: , | D24: неприятности не избыть. | E24: И. С. Шмелев. Богомолье (1930-1931) | F24: И. С. Шмелев | G24: 1873 | H24: Богомолье | I24: 1930-1931 | J24: художественная | K24: повесть | M24: Шмелев И. С. Избранные сочинения: в 2-х тт. Т.2 | N24: 1999 | O24: книга | P24: омонимия не снята | Q24: Упаси Бог, живых бы с покойниками не спутали, неприятности не избыть. [И. С. Шмелев. Богомолье (1930-1931)] [омонимия не снята] | R24: =RAND() -> 0.3889302004361328 | S24: с | T24: Прошедшее | U24: мн.ч. | V24: NA | W24: человек | X24: человек | Y24: NA
A25: того, чтобы вы, спросонья, не | B25: спутали | D25: его с пожарным колоколом. | E25: М. И. Цветаева. Из дневника (1918-1919) | F25: М. И. Цветаева | G25: 1892 | H25: Из дневника | I25: 1918-1919 | J25: публицистика , нехудожественная | K25: очерк | O25: книга | P25: омонимия не снята | Q25: Поясняю вам сие, братья, для того, чтобы вы, спросонья, не спутали его с пожарным колоколом. [М. И. Цветаева. Из дневника (1918-1919)] [омонимия не снята] | R25: =RAND() -> 2.9575912707686669E-2 | S25: с | T25: Прошедшее | U25: мн.ч. | V25: человек | W25: NA | X25: неодушевленный конкретный предмет
A26: в обедах. Вы, верно, что-нибудь | B26: спутали | C26: . | D26: Они потоптались и повысили мой | E26: Н. А. Тэффи. Воспоминания (1932) | F26: Н. А. Тэффи | G26: 1872 | H26: Воспоминания | I26: 1932 | J26: публицистика , нехудожественная | K26: мемуары | M26: Надежда Тэффи. Моя летопись | N26: 2004 | O26: книга | P26: омонимия не снята | Q26: ― Я же ничего не понимаю ни в карточной игре, ни в обедах. Вы, верно, что-нибудь спутали. Они потоптались и повысили мой гонорар. [Н. А. Тэффи. Воспоминания (1932)] [омонимия не снята] | R26: =RAND() -> 0.63279746330286879 | S26: с | T26: Прошедшее | U26: мн.ч. | V26: человек | W26: NA | X26: NA | Y26: NA
A27: и две Матрены родились! Всех | B27: перепутаешь | D27: как раз. ― Уж так с | E27: Д. Н. Мамин-Сибиряк. В глуши (1896) | F27: Д. Н. Мамин-Сибиряк | G27: 1852 | H27: В глуши | I27: 1896 | J27: художественная | K27: рассказ | M27: Д. Н. Мамин-Сибиряк. Избранные произведения для детей | N27: 1962 | O27: книга | P27: омонимия не снята | Q27: ― Вот в нынешнем году три Ивана Шалаевых умерли и три Ивана Шалаевых родились, а в прошлом году было то же самое с Матренами, ― две Матрены умерли и две Матрены родились! Всех перепутаешь как раз. ― Уж так с испокон веку, ― объяснял староста, ― все Шалаевы, и делу конец! [Д. Н. Мамин-Сибиряк. В глуши (1896)] [омонимия не снята] | R27: =RAND() -> 0.23337610097838946 | S27: пере | T27: Будущее | U27: 2л. ед.ч. | V27: человек | W27: NA
A28: трогай, пожалуйста, ты мне все | B28: перепутаешь | C28: … | E28: А. А. Григорьев. Человек будущего (1845) | F28: А. А. Григорьев | G28: 1822 | H28: Человек будущего | I28: 1845 | J28: публицистика , нехудожественная | K28: мемуары | M28: Аполлон Григорьев. Воспоминания | N28: 1980 | O28: книга | P28: омонимия не снята | Q28: ― Ах, не трогай, пожалуйста, ты мне все перепутаешь… [А. А. Григорьев. Человек будущего (1845)] [омонимия не снята] | R28: =RAND() -> 0.636560040762708 | S28: пере | T28: Будущее | U28: 2л. ед.ч. | V28: человек | W28: NA
A29: не читал. Возможно, что Исаченко | B29: перепутал | C29: . | D29: За последнее время термин «евразийская | E29: Н. С. Трубецкой. Письма Р. О. Якобсону (1920-1938) | F29: Н. С. Трубецкой | G29: 1890 | H29: Письма Р. О. Якобсону | I29: 1920-1938 | J29: учебно-научная , нехудожественная | K29: письмо | L29: наука и технологии, филология, частная жизнь | M29: Письма и заметки Н. С. Трубецкого | N29: 2004 | O29: книга | P29: омонимия не снята | Q29: Статьи американца Farres'а, о которой Вы пишете, я не читал. Возможно, что Исаченко перепутал. За последнее время термин «евразийская семья языков» пущен в ход нашумевшей (но, по существу, пустоватой) книгой Koppelmann'а («Die euras. [Н. С. Трубецкой. Письма Р. О. Якобсону (1920-1938)] [омонимия не снята] | R29: =RAND() -> 0.80225581015544822 | S29: пере | T29: Прошедшее | U29: ед.ч. м.р. | V29: человек | W29: NA
A30: я не забыл или не | B30: перепутал | C30: . | E30: С. Гиль. Владимир Ильич на досуге (1928) // Охота и охотничье хозяйство, 1969 | F30: С. Гиль | G30: 1888 | H30: Владимир Ильич на досуге | I30: 1928 | J30: публицистика, нехудожественная | K30: мемуары | L30: частная жизнь | M30: Охота и охотничье хозяйство | N30: 1969 | O30: журнал | P30: омонимия не снята | Q30: — Обязательно все точно опишите, чтобы я не забыл или не перепутал. [С. Гиль. Владимир Ильич на досуге (1928) // Охота и охотничье хозяйство, 1969] [омонимия не снята] | R30: =RAND() -> 0.11631478764444869 | S30: пере | T30: Прошедшее | U30: ед.ч. м.р. | V30: человек | W30: NA
A31: коня зря угнал! Весь план | B31: перепутал | C31: . | D31: Место было приготовлено, куда ехать | E31: Валентин Курицын. Томские трущобы (1906) | F31: Валентин Курицын | G31: 1878 | H31: Томские трущобы | I31: 1906 | J31: художественная | K31: роман | O31: книга | P31: омонимия не снята | Q31: Пошто коня зря угнал! Весь план перепутал. Место было приготовлено, куда ехать. [Валентин Курицын. Томские трущобы (1906)] [омонимия не снята] | R31: =RAND() -> 0.61423977443285238 | S31: пере | T31: Прошедшее | U31: ед.ч. м.р. | V31: человек | W31: абстрактный предмет
A32: что Ф.Карабин не случайно | B32: перепутал | D32: заглавие. | E32: Л. К. Чуковская. Ферапонта Петровна // Литературная газета, 1934 | F32: Л. К. Чуковская | G32: 1907 | H32: Ферапонта Петровна | I32: 1934 | J32: учебно-научная , нехудожественная | K32: статья | L32: наука и технологии, филология | M32: Литературная газета | N32: 1934 | O32: газета | P32: омонимия не снята | Q32: Беда в том, что К.Золотовскому критик Карабин посвящает два абзаца, и оба эти абзаца неопровержимо доказывают, что Ф.Карабин не случайно перепутал заглавие. [Л. К. Чуковская. Ферапонта Петровна // Литературная газета, 1934] [омонимия не снята] | R32: =RAND() -> 0.17991801600556268 | S32: пере | T32: Прошедшее | U32: ед.ч. м.р. | V32: человек | W32: абстрактный предмет
A33: встряхнул шахматную доску жизни и | B33: перепутал | D33: и разбросал фигуры. | E33: С. Н. Сергеев-Ценский. Бабаев (1906-1907) | F33: С. Н. Сергеев-Ценский | G33: 1875 | H33: Бабаев | I33: 1906-1907 | J33: художественная | K33: роман | M33: Сергеев-Ценский С. Н. Собрание сочинений. В 12 томах. Т. 1 | N33: 1967 | O33: книга | P33: омонимия не снята | Q33: Кто-то встряхнул шахматную доску жизни и перепутал и разбросал фигуры. [С. Н. Сергеев-Ценский. Бабаев (1906-1907)] [омонимия не снята] | R33: =RAND() -> 0.66124287481836264 | S33: пере | T33: Прошедшее | U33: ед.ч. м.р. | V33: NA | W33: неодушевленный конкретный предмет
A34: такое, собственно говоря?.. Михайлов все | B34: перепутал | C34: … | D34: Что за безобразие!.. | E34: Е. П. Карпов. А. С. Суворин и основание театра литературно-артистического кружка. Странички из воспоминаний «Минувшее» (1914) | F34: Е. П. Карпов | G34: 1857 | H34: А. С. Суворин и основание театра литературно-артистического кружка. Странички из воспоминаний «Минувшее» | I34: 1914 | J34: публицистика , нехудожественная | K34: мемуары | L34: администрация и управление, искусство и культура | M34: «А. С. Суворин в воспоминаниях современников» | N34: 2001 | O34: книга | P34: омонимия не снята | Q34: ― Что же это такое, собственно говоря?.. Михайлов все перепутал… Что за безобразие!.. [Е. П. Карпов. А. С. Суворин и основание театра литературно-артистического кружка. Странички из воспоминаний «Минувшее» (1914)] [омонимия не снята] | R34: =RAND() -> 0.41172952989504774 | S34: пере | T34: Прошедшее | U34: ед.ч. м.р. | V34: человек | W34: NA
A35: бы сцепил дерево с деревом, | B35: перепутал | D35: ветви, выбросил свет, где никто | E35: П. В. Анненков. Литературные воспоминания (1882) | F35: П. В. Анненков | G35: 1812 | H35: Литературные воспоминания | I35: 1882 | J35: публицистика , нехудожественная | K35: мемуары | L35: искусство и культура, история, политика и общественная жизнь, администрация и управление, строительство и архитектура, религия, частная жизнь | M35: «Литературные воспоминания». Серия литературных мемуаров под общей редакцией С. Н. Голубова, В. В. Григоренко, Н. К. Гудзия, С. А. Макашина, Ю. Г. Оксмана | N35: 1960 | O35: книга | P35: омонимия не снята | Q35: Я бы сцепил дерево с деревом, перепутал ветви, выбросил свет, где никто не ожидает его, вот какие пейзажи надо писать!» [П. В. Анненков. Литературные воспоминания (1882)] [омонимия не снята] | R35: =RAND() -> 0.68564758059806219 | S35: пере | T35: Прошедшее | U35: ед.ч. м.р. | V35: NA | W35: неодушевленный конкретный предмет
A36: Чтобы зритель не | B36: перепутал | D36: времен года, под каждой картиной | E36: А. С. Грин. Дорога никуда (1929) | F36: А. С. Грин | G36: 1880 | H36: Дорога никуда | I36: 1929 | J36: художественная | K36: рассказ | M36: А. С. Грин. Собрание сочинений, т. 6 | N36: 1965 | O36: книга | P36: омонимия не снята | Q36: Чтобы зритель не перепутал времен года, под каждой картиной стояла надпись, сделанная черными наклейными буквами, внизу рам. [А. С. Грин. Дорога никуда (1929)] [омонимия не снята] | R36: =RAND() -> 0.37434999287091886 | S36: пере | T36: Прошедшее | U36: ед.ч. м.р. | V36: человек | W36: абстрактный предмет
A37: ты, ска-а-тина, все | B37: перепутал | C37: ! | E37: А. Ф. Вельтман. Приключения, почерпнутые из моря житейского. Саломея (1848) | F37: А. Ф. Вельтман | G37: 1800 | H37: Приключения, почерпнутые из моря житейского. Саломея | I37: 1848 | J37: художественная | K37: роман | M37: Вельтман А. Ф. Приключения, почерпнутые из моря житейского | N37: 1957 | O37: книга | P37: омонимия не снята | Q37: ― Да врешь, братец, ты, ска-а-тина, все перепутал! [А. Ф. Вельтман. Приключения, почерпнутые из моря житейского. Саломея (1848)] [омонимия не снята] | R37: =RAND() -> 0.40240894355640899 | S37: пере | T37: Прошедшее | U37: ед.ч. м.р. | V37: человек | W37: NA
A38: подумал,что друг его что-то | B38: перепутал | C38: . | D38: Никодим стоял в кабинете, пока | E38: А. Д. Скалдин. Странствия и приключения Никодима Старшего (1917) | F38: А. Д. Скалдин | G38: 1885 | H38: Странствия и приключения Никодима Старшего | I38: 1917 | J38: художественная | K38: роман | M38: Странствия и приключения Никодима Старшего | N38: 1994 | O38: книга | P38: омонимия не снята | Q38: Действительно, это были странные ключи ― огромные, ржавые и все до одного совершенно схожие между собой. Еще не скоро загромыхали на дворе ломовые телеги, и у Никодима было достаточно времени делать разные догадки, но когда извозчики подъехали, он выглянул в окно на двор, и, увидев на двух подводах все десять шкафов, по пяти на каждой телеге ― не очень больших, не очень маленьких, старых и ни в чем друг от друга не отличающихся, притом самых обыкновенных, рыночной работы, ― он подумал,что друг его что-то перепутал. Никодим стоял в кабинете, пока извозчики вносили шкафы и расставляли их по коридору. [А. Д. Скалдин. Странствия и приключения Никодима Старшего (1917)] [омонимия не снята] | R38: =RAND() -> 0.99789698869085042 | S38: пере | T38: Прошедшее | U38: ед.ч. м.р. | V38: человек | W38: NA
A39: и он все позабыл, все | B39: перепутал | C39: , ― | D39: сказал доктор и подумал: «Притворяется | E39: В. Я. Шишков. Угрюм-река. Ч. 5-8 (1913-1932) | F39: В. Я. Шишков | G39: 1873 | H39: Угрюм-река. Ч. 5-8 | I39: 1913-1932 | J39: художественная | K39: роман | M39: Шишков, В. Я.: Угрюм-река | N39: 1987 | O39: книга | P39: омонимия не снята | Q39: А то у барина приключилась горячка от простуды, и он все позабыл, все перепутал, ― сказал доктор и подумал: «Притворяется Прохор Петрович или нет?» [В. Я. Шишков. Угрюм-река. Ч. 5-8 (1913-1932)] [омонимия не снята] | R39: =RAND() -> 0.20435686743821013 | S39: пере | T39: Прошедшее | U39: ед.ч. м.р. | V39: человек | W39: NA
A40: но, быть может, фамилию его | B40: перепутал | C40: . | E40: Николай Варенцов. Слышанное. Виденное. Передуманное. Пережитое (1930-1935) | F40: Николай Варенцов | G40: 1862 | H40: Слышанное. Виденное. Передуманное. Пережитое | I40: 1930-1935 | J40: публицистика , нехудожественная | K40: мемуары | M40: Слышанное. Виденное. Передуманное. Пережитое | N40: 2011 | O40: книга | P40: омонимия не снята | Q40: На этот обед, даваемый министру, пользуясь тем, что мы были одни из распорядителей обеда, пригласили некоторых из своих знакомых, участвующих в нашем спиритическом кружке; один из них ― крупный инженер с Московско-Брестской железной дороги И.О. Ярковский, другой ― служащий в таможне Благоволин, но, быть может, фамилию его перепутал. [Николай Варенцов. Слышанное. Виденное. Передуманное. Пережитое (1930-1935)] [омонимия не снята] | R40: =RAND() -> 0.86783626313518991 | S40: пере | T40: Прошедшее | U40: ед.ч. м.р. | V40: NA | W40: абстрактный предмет
A41: и братьев?.. Я все перезабыл, | B41: перепутал | C41: … | D41: Бакунина назвала их деревню и | E41: Н. А. Тучкова-Огарева. Воспоминания (1890) | F41: Н. А. Тучкова-Огарева | G41: 1829 | H41: Воспоминания | I41: 1890 | J41: публицистика , нехудожественная | K41: мемуары | M41: Н. А. Тучкова-Огарева. Воспоминания | O41: книга | P41: омонимия не снята | Q41: Вы были у них в деревне ― как зовут сестер и братьев?.. Я все перезабыл, перепутал… Бакунина назвала их деревню и вообще отвечала в точности на все вопросы. [Н. А. Тучкова-Огарева. Воспоминания (1890)] [омонимия не снята] | R41: =RAND() -> 0.62353836924407535 | S41: пере | T41: Прошедшее | U41: ед.ч. м.р. | V41: человек | W41: NA
A42: портреты китайцев повесить и вот | B42: перепутала | C42: … | E42: Н. И. Ильина. Иными глазами. Очерки шанхайской жизни (1946) | F42: Н. И. Ильина | G42: 1914 | H42: Иными глазами. Очерки шанхайской жизни | I42: 1946 | J42: публицистика, нехудожественная | K42: очерк | L42: искусство и культура, частная жизнь, политика и общественная жизнь, история | M42: Н. И. Ильина. Иными глазами. Шанхай, Эпоха, 1946 | N42: 1946 | O42: книга | P42: омонимия не снята | Q42: ― говорила Софья Павловна, моргая близорукими беспомощными глазами, ― я же хотела портреты китайцев повесить и вот перепутала… [Н. И. Ильина. Иными глазами. Очерки шанхайской жизни (1946)] [омонимия не снята] | R42: =RAND() -> 0.87214840564992857 | S42: пере | T42: Прошедшее | U42: ед.ч. ж.р. | V42: NA | W42: NA
A43: военных делах и как дилетантка | B43: перепутала | D43: все слышанное. | E43: А. К. Шеллер-Михайлов. Лес рубят - щепки летят (1871) | F43: А. К. Шеллер-Михайлов | G43: 1838 | H43: Лес рубят - щепки летят | I43: 1871 | J43: художественная | K43: роман | M43: Шеллер-Михайлов А. К. Лес рубят - щепки летят | N43: 1984 | O43: книга | P43: омонимия не снята | Q43: Она, конечно, не умела передать этих известий с точностью специалиста в военных делах и как дилетантка перепутала все слышанное. [А. К. Шеллер-Михайлов. Лес рубят - щепки летят (1871)] [омонимия не снята] | R43: =RAND() -> 8.718688171477107E-2 | S43: пере | T43: Прошедшее | U43: ед.ч. ж.р. | V43: человек | W43: NA
A44: настоящее время выяснилось, что покойная | B44: перепутала | D44: в завещании имя и фамилию | E44: В России (1912.02.25) // «Русское слово», 1912 | H44: В России | I44: 1912.02.25 | J44: публицистика , нехудожественная | K44: информационное сообщение | L44: администрация и управление, образование, религия, частная жизнь | M44: «Русское слово» | N44: 1912 | O44: газета | P44: омонимия не снята | Q44: В настоящее время выяснилось, что покойная перепутала в завещании имя и фамилию своего фаворита. [В России (1912.02.25) // «Русское слово», 1912] [омонимия не снята] | R44: =RAND() -> 1.5683623491500098E-2 | S44: пере | T44: Прошедшее | U44: ед.ч. ж.р. | V44: человек | W44: абстрактный предмет
A45: ― Ах, господи! | B45: Перепутала | C45: ! | D45: ― Господь тут ни при чем | E45: В. В. Вересаев. Сестры (1928-1931) | F45: В. В. Вересаев | G45: 1867 | H45: Сестры | I45: 1928-1931 | J45: художественная | K45: роман | O45: книга | P45: омонимия не снята | Q45: ― Ах, господи! Перепутала! ― Господь тут ни при чем, кстати, его даже и не существует. [В. В. Вересаев. Сестры (1928-1931)] [омонимия не снята] | R45: =RAND() -> 0.49655861508683552 | S45: пере | T45: Прошедшее | U45: ед.ч. ж.р. | V45: человек | W45: NA
A46: нетрезвом виде, хотела опохмелиться, но | B46: перепутала | D46: бутылки и вместо водки, выпила | E46: неизвестный. Городские происшествия (1901.10.18) // «Новости дня», 1901 | F46: неизвестный | H46: Городские происшествия | I46: 1901.10.18 | J46: публицистика , нехудожественная | K46: информационное сообщение | L46: частная жизнь | M46: «Новости дня» | N46: 1901 | O46: газета | P46: омонимия не снята | Q46: 3-го октября проживающая в доме Медведева по Охотничьему переулку, московская мещанка Наталья Николаева Сергеева, находясь в нетрезвом виде, хотела опохмелиться, но перепутала бутылки и вместо водки, выпила русского скипидару, после чего заболела с признаками отравления. [неизвестный. Городские происшествия (1901.10.18) // «Новости дня», 1901] [омонимия не снята] | R46: =RAND() -> 0.42288516184959934 | S46: пере | T46: Прошедшее | U46: ед.ч. ж.р. | V46: человек | W46: неодушевленный конкретный предмет
A47: опять пути-дороженьки… Ну, и | B47: перепутала | D47: все!.. Давно это было! | E47: В. И. Немирович-Данченко. Соловки (1874) | F47: В. И. Немирович-Данченко | G47: 1848 | H47: Соловки | I47: 1874 | J47: художественная | K47: очерк, цикл | M47: В. В. Немирович-Данченко. Сочинения. Том.2. Из книги паломничеств и путешествий | N47: 1996 | O47: книга | P47: омонимия не снята | Q47: Там опять пути-дороженьки… Ну, и перепутала все!.. Давно это было! [В. И. Немирович-Данченко. Соловки (1874)] [омонимия не снята] | R47: =RAND() -> 0.5859267845373044 | S47: пере | T47: Прошедшее | U47: ед.ч. ж.р. | V47: NA | W47: NA
A48: Ах, Аксюта! Все мои дела | B48: перепутала | C48: ». | D48: И наконец Неплюев решил бесповоротно | E48: Е. А. Салиас. Крутоярская царевна (1893) | F48: Е. А. Салиас | G48: 1842 | H48: Крутоярская царевна | I48: 1893 | J48: художественная | K48: повесть | M48: Салиас Е. А. Сочинения в 2 тт. Т. 1 | N48: 1991 | O48: книга | P48: омонимия не снята | Q48: Ах, Аксюта! Все мои дела перепутала». И наконец Неплюев решил бесповоротно: [Е. А. Салиас. Крутоярская царевна (1893)] [омонимия не снята] | R48: =RAND() -> 0.36574540350845952 | S48: пере | T48: Прошедшее | U48: ед.ч. ж.р. | V48: человек | W48: абстрактный предмет
A49: желтыми оскаленными зубами тревогой охватившей | B49: перепутали | D49: Мишкины мысли, больно ударило затекавшее | E49: А. С. Неверов. Ташкент ― город хлебный (1923) | F49: А. С. Неверов | G49: 1886 | H49: Ташкент ― город хлебный | I49: 1923 | J49: художественная | K49: повесть | M49: А. Неверов. Ташкент - город хлебный | N49: 1925 | O49: книга | P49: омонимия не снята | Q49: Тонкий посиневший нос, неподвижно разинутый рот с желтыми оскаленными зубами тревогой охватившей перепутали Мишкины мысли, больно ударило затекавшее сердце. [А. С. Неверов. Ташкент ― город хлебный (1923)] [омонимия не снята] | R49: =RAND() -> 1.5595186692339058E-2 | S49: пере | T49: Прошедшее | U49: мн.ч. | V49: NA | W49: абстрактный предмет
A50: он автор сегодняшней пьесы. ― Вы | B50: перепутали | C50: . | D50: Григоровича комедия только сейчас будет | E50: А. А. Нильский. Закулисная хроника. 1856 -- 1894 (1856-1894) | F50: А. А. Нильский | G50: 1840 | H50: Закулисная хроника. 1856 -- 1894 | I50: 1856-1894 | J50: публицистика, нехудожественная | K50: мемуары | O50: книга | P50: омонимия не снята | Q50: Автор пьесы… Ты ведь сам сказал, что он автор сегодняшней пьесы. ― Вы перепутали. Григоровича комедия только сейчас будет играться, а это Штеллер, автор «Ошибок молодости», которую только что мы сыграли… [А. А. Нильский. Закулисная хроника. 1856 -- 1894 (1856-1894)] [омонимия не снята] | R50: =RAND() -> 0.44235565465514837 | S50: пере | T50: Прошедшее | U50: мн.ч. | V50: человек | W50: NA
A51: черной дыры портала, и это | B51: перепутало | D51: все элементы его самочувствия? | E51: К. С. Станиславский. Работа актера над собой (1938) | F51: К. С. Станиславский | G51: 1863 | H51: Работа актера над собой | I51: 1938 | J51: учебно-научная , нехудожественная | K51: монография | L51: искусство и культура | M51: Работа актера над собой | N51: 1938 | O51: книга | P51: омонимия не снята | Q51: Может быть, артист испугался черной дыры портала, и это перепутало все элементы его самочувствия? [К. С. Станиславский. Работа актера над собой (1938)] [омонимия не снята] | R51: =RAND() -> 0.28764469851047325 | S51: пере | T51: Прошедшее | U51: ед.ч. ср.р. | V51: NA | W51: абстрактный предмет

Sheet: с
A1: Prefix | B1: Tense
A2: c | B2: Будущее
A3: c | B3: Будущее
A4: c | B4: Прошедшее
A5: c | B5: Прошедшее
A6: c | B6: Прошедшее
A7: c | B7: Прошедшее
A8: c | B8: Прошедшее
A9: c | B9: Прошедшее
A10: c | B10: Прошедшее
A11: c | B11: Прошедшее
A12: c | B12: Прошедшее
A13: c | B13: Прошедшее
A14: c | B14: Прошедшее
A15: c | B15: Прошедшее
A16: c | B16: Прошедшее
A17: c | B17: Прошедшее
A18: c | B18: Прошедшее
A19: c | B19: Прошедшее
A20: c | B20: Прошедшее
A21: c | B21: Прошедшее
A22: c | B22: Прошедшее
A23: c | B23: Прошедшее
A24: c | B24: Прошедшее
A25: c | B25: Прошедшее
A26: c | B26: Прошедшее
A27: пере | B27: Будущее
A28: пере | B28: Будущее
A29: пере | B29: Прошедшее
A30: пере | B30: Прошедшее
A31: пере | B31: Прошедшее
A32: пере | B32: Прошедшее
A33: пере | B33: Прошедшее
A34: пере | B34: Прошедшее
A35: пере | B35: Прошедшее
A36: пере | B36: Прошедшее
A37: пере | B37: Прошедшее
A38: пере | B38: Прошедшее
A39: пере | B39: Прошедшее
A40: пере | B40: Прошедшее
A41: пере | B41: Прошедшее
A42: пере | B42: Прошедшее
A43: пере | B43: Прошедшее
A44: пере | B44: Прошедшее
A45: пере | B45: Прошедшее
A46: пере | B46: Прошедшее
A47: пере | B47: Прошедшее
A48: пере | B48: Прошедшее
A49: пере | B49: Прошедшее
A50: пере | B50: Прошедшее
A51: пере | B51: Прошедшее

Sheet: пере
C1: Left context | D1: Center | E1: Punct | F1: Right context | G1: Title | H1: Author | I1: Birthday | J1: Header | K1: Created | L1: Sphere | M1: Type | N1: Topic | O1: Publication | P1: Publ_year | Q1: Medium | R1: Ambiguity | S1: Full context | T1: =RAND() -> 0.36246341817750438 | U1: PREFIX | V1: TENSE | W1: PERSONNUMBER | X1: PARTICIPANT1 | Y1: PARTICIPANT2
C2: и две Матрены родились! Всех | D2: перепутаешь | F2: как раз. ― Уж так с | G2: Д. Н. Мамин-Сибиряк. В глуши (1896) | H2: Д. Н. Мамин-Сибиряк | I2: 1852 | J2: В глуши | K2: 1896 | L2: художественная | M2: рассказ | O2: Д. Н. Мамин-Сибиряк. Избранные произведения для детей | P2: 1962 | Q2: книга | R2: омонимия не снята | S2: ― Вот в нынешнем году три Ивана Шалаевых умерли и три Ивана Шалаевых родились, а в прошлом году было то же самое с Матренами, ― две Матрены умерли и две Матрены родились! Всех перепутаешь как раз. ― Уж так с испокон веку, ― объяснял староста, ― все Шалаевы, и делу конец! [Д. Н. Мамин-Сибиряк. В глуши (1896)] [омонимия не снята] | T2: =RAND() -> 0.24697888737096418 | U2: пере | V2: Будущее | W2: 2л. ед.ч. | X2: человек | Y2: NA
C3: трогай, пожалуйста, ты мне все | D3: перепутаешь | E3: … | G3: А. А. Григорьев. Человек будущего (1845) | H3: А. А. Григорьев | I3: 1822 | J3: Человек будущего | K3: 1845 | L3: публицистика , нехудожественная | M3: мемуары | O3: Аполлон Григорьев. Воспоминания | P3: 1980 | Q3: книга | R3: омонимия не снята | S3: ― Ах, не трогай, пожалуйста, ты мне все перепутаешь… [А. А. Григорьев. Человек будущего (1845)] [омонимия не снята] | T3: =RAND() -> 0.31607656241197268 | U3: пере | V3: Будущее | W3: 2л. ед.ч. | X3: человек | Y3: NA
C4: не читал. Возможно, что Исаченко | D4: перепутал | E4: . | F4: За последнее время термин «евразийская | G4: Н. С. Трубецкой. Письма Р. О. Якобсону (1920-1938) | H4: Н. С. Трубецкой | I4: 1890 | J4: Письма Р. О. Якобсону | K4: 1920-1938 | L4: учебно-научная , нехудожественная | M4: письмо | N4: наука и технологии, филология, частная жизнь | O4: Письма и заметки Н. С. Трубецкого | P4: 2004 | Q4: книга | R4: омонимия не снята | S4: Статьи американца Farres'а, о которой Вы пишете, я не читал. Возможно, что Исаченко перепутал. За последнее время термин «евразийская семья языков» пущен в ход нашумевшей (но, по существу, пустоватой) книгой Koppelmann'а («Die euras. [Н. С. Трубецкой. Письма Р. О. Якобсону (1920-1938)] [омонимия не снята] | T4: =RAND() -> 0.61808087067738271 | U4: пере | V4: Прошедшее | W4: ед.ч. м.р. | X4: человек | Y4: NA
C5: я не забыл или не | D5: перепутал | E5: . | G5: С. Гиль. Владимир Ильич на досуге (1928) // Охота и охотничье хозяйство, 1969 | H5: С. Гиль | I5: 1888 | J5: Владимир Ильич на досуге | K5: 1928 | L5: публицистика, нехудожественная | M5: мемуары | N5: частная жизнь | O5: Охота и охотничье хозяйство | P5: 1969 | Q5: журнал | R5: омонимия не снята | S5: — Обязательно все точно опишите, чтобы я не забыл или не перепутал. [С. Гиль. Владимир Ильич на досуге (1928) // Охота и охотничье хозяйство, 1969] [омонимия не снята] | T5: =RAND() -> 0.76864827164022387 | U5: пере | V5: Прошедшее | W5: ед.ч. м.р. | X5: человек | Y5: NA
C6: коня зря угнал! Весь план | D6: перепутал | E6: . | F6: Место было приготовлено, куда ехать | G6: Валентин Курицын. Томские трущобы (1906) | H6: Валентин Курицын | I6: 1878 | J6: Томские трущобы | K6: 1906 | L6: художественная | M6: роман | Q6: книга | R6: омонимия не снята | S6: Пошто коня зря угнал! Весь план перепутал. Место было приготовлено, куда ехать. [Валентин Курицын. Томские трущобы (1906)] [омонимия не снята] | T6: =RAND() -> 0.89323302347603573 | U6: пере | V6: Прошедшее | W6: ед.ч. м.р. | X6: человек | Y6: абстрактный предмет
C7: что Ф.Карабин не случайно | D7: перепутал | F7: заглавие. | G7: Л. К. Чуковская. Ферапонта Петровна // Литературная газета, 1934 | H7: Л. К. Чуковская | I7: 1907 | J7: Ферапонта Петровна | K7: 1934 | L7: учебно-научная , нехудожественная | M7: статья | N7: наука и технологии, филология | O7: Литературная газета | P7: 1934 | Q7: газета | R7: омонимия не снята | S7: Беда в том, что К.Золотовскому критик Карабин посвящает два абзаца, и оба эти абзаца неопровержимо доказывают, что Ф.Карабин не случайно перепутал заглавие. [Л. К. Чуковская. Ферапонта Петровна // Литературная газета, 1934] [омонимия не снята] | T7: =RAND() -> 0.51500908243837651 | U7: пере | V7: Прошедшее | W7: ед.ч. м.р. | X7: человек | Y7: абстрактный предмет
C8: встряхнул шахматную доску жизни и | D8: перепутал | F8: и разбросал фигуры. | G8: С. Н. Сергеев-Ценский. Бабаев (1906-1907) | H8: С. Н. Сергеев-Ценский | I8: 1875 | J8: Бабаев | K8: 1906-1907 | L8: художественная | M8: роман | O8: Сергеев-Ценский С. Н. Собрание сочинений. В 12 томах. Т. 1 | P8: 1967 | Q8: книга | R8: омонимия не снята | S8: Кто-то встряхнул шахматную доску жизни и перепутал и разбросал фигуры. [С. Н. Сергеев-Ценский. Бабаев (1906-1907)] [омонимия не снята] | T8: =RAND() -> 0.99419440695733108 | U8: пере | V8: Прошедшее | W8: ед.ч. м.р. | X8: NA | Y8: неодушевленный конкретный предмет
C9: такое, собственно говоря?.. Михайлов все | D9: перепутал | E9: … | F9: Что за безобразие!.. | G9: Е. П. Карпов. А. С. Суворин и основание театра литературно-артистического кружка. Странички из воспоминаний «Минувшее» (1914) | H9: Е. П. Карпов | I9: 1857 | J9: А. С. Суворин и основание театра литературно-артистического кружка. Странички из воспоминаний «Минувшее» | K9: 1914 | L9: публицистика , нехудожественная | M9: мемуары | N9: администрация и управление, искусство и культура | O9: «А. С. Суворин в воспоминаниях современников» | P9: 2001 | Q9: книга | R9: омонимия не снята | S9: ― Что же это такое, собственно говоря?.. Михайлов все перепутал… Что за безобразие!.. [Е. П. Карпов. А. С. Суворин и основание театра литературно-артистического кружка. Странички из воспоминаний «Минувшее» (1914)] [омонимия не снята] | T9: =RAND() -> 4.7407131339579855E-2 | U9: пере | V9: Прошедшее | W9: ед.ч. м.р. | X9: человек | Y9: NA
C10: бы сцепил дерево с деревом, | D10: перепутал | F10: ветви, выбросил свет, где никто | G10: П. В. Анненков. Литературные воспоминания (1882) | H10: П. В. Анненков | I10: 1812 | J10: Литературные воспоминания | K10: 1882 | L10: публицистика , нехудожественная | M10: мемуары | N10: искусство и культура, история, политика и общественная жизнь, администрация и управление, строительство и архитектура, религия, частная жизнь | O10: «Литературные воспоминания». Серия литературных мемуаров под общей редакцией С. Н. Голубова, В. В. Григоренко, Н. К. Гудзия, С. А. Макашина, Ю. Г. Оксмана | P10: 1960 | Q10: книга | R10: омонимия не снята | S10: Я бы сцепил дерево с деревом, перепутал ветви, выбросил свет, где никто не ожидает его, вот какие пейзажи надо писать!» [П. В. Анненков. Литературные воспоминания (1882)] [омонимия не снята] | T10: =RAND() -> 0.81561441755010378 | U10: пере | V10: Прошедшее | W10: ед.ч. м.р. | X10: NA | Y10: неодушевленный конкретный предмет
C11: Чтобы зритель не | D11: перепутал | F11: времен года, под каждой картиной | G11: А. С. Грин. Дорога никуда (1929) | H11: А. С. Грин | I11: 1880 | J11: Дорога никуда | K11: 1929 | L11: художественная | M11: рассказ | O11: А. С. Грин. Собрание сочинений, т. 6 | P11: 1965 | Q11: книга | R11: омонимия не снята | S11: Чтобы зритель не перепутал времен года, под каждой картиной стояла надпись, сделанная черными наклейными буквами, внизу рам. [А. С. Грин. Дорога никуда (1929)] [омонимия не снята] | T11: =RAND() -> 0.26838910059808652 | U11: пере | V11: Прошедшее | W11: ед.ч. м.р. | X11: человек | Y11: абстрактный предмет
C12: ты, ска-а-тина, все | D12: перепутал | E12: ! | G12: А. Ф. Вельтман. Приключения, почерпнутые из моря житейского. Саломея (1848) | H12: А. Ф. Вельтман | I12: 1800 | J12: Приключения, почерпнутые из моря житейского. Саломея | K12: 1848 | L12: художественная | M12: роман | O12: Вельтман А. Ф. Приключения, почерпнутые из моря житейского | P12: 1957 | Q12: книга | R12: омонимия не снята | S12: ― Да врешь, братец, ты, ска-а-тина, все перепутал! [А. Ф. Вельтман. Приключения, почерпнутые из моря житейского. Саломея (1848)] [омонимия не снята] | T12: =RAND() -> 0.42245348364273161 | U12: пере | V12: Прошедшее | W12: ед.ч. м.р. | X12: человек | Y12: NA
C13: подумал,что друг его что-то | D13: перепутал | E13: . | F13: Никодим стоял в кабинете, пока | G13: А. Д. Скалдин. Странствия и приключения Никодима Старшего (1917) | H13: А. Д. Скалдин | I13: 1885 | J13: Странствия и приключения Никодима Старшего | K13: 1917 | L13: художественная | M13: роман | O13: Странствия и приключения Никодима Старшего | P13: 1994 | Q13: книга | R13: омонимия не снята | S13: Действительно, это были странные ключи ― огромные, ржавые и все до одного совершенно схожие между собой. Еще не скоро загромыхали на дворе ломовые телеги, и у Никодима было достаточно времени делать разные догадки, но когда извозчики подъехали, он выглянул в окно на двор, и, увидев на двух подводах все десять шкафов, по пяти на каждой телеге ― не очень больших, не очень маленьких, старых и ни в чем друг от друга не отличающихся, притом самых обыкновенных, рыночной работы, ― он подумал,что друг его что-то перепутал. Никодим стоял в кабинете, пока извозчики вносили шкафы и расставляли их по коридору. [А. Д. Скалдин. Странствия и приключения Никодима Старшего (1917)] [омонимия не снята] | T13: =RAND() -> 0.17227953860485168 | U13: пере | V13: Прошедшее | W13: ед.ч. м.р. | X13: человек | Y13: NA
C14: и он все позабыл, все | D14: перепутал | E14: , ― | F14: сказал доктор и подумал: «Притворяется | G14: В. Я. Шишков. Угрюм-река. Ч. 5-8 (1913-1932) | H14: В. Я. Шишков | I14: 1873 | J14: Угрюм-река. Ч. 5-8 | K14: 1913-1932 | L14: художественная | M14: роман | O14: Шишков, В. Я.: Угрюм-река | P14: 1987 | Q14: книга | R14: омонимия не снята | S14: А то у барина приключилась горячка от простуды, и он все позабыл, все перепутал, ― сказал доктор и подумал: «Притворяется Прохор Петрович или нет?» [В. Я. Шишков. Угрюм-река. Ч. 5-8 (1913-1932)] [омонимия не снята] | T14: =RAND() -> 0.90846483900599106 | U14: пере | V14: Прошедшее | W14: ед.ч. м.р. | X14: человек | Y14: NA
C15: но, быть может, фамилию его | D15: перепутал | E15: . | G15: Николай Варенцов. Слышанное. Виденное. Передуманное. Пережитое (1930-1935) | H15: Николай Варенцов | I15: 1862 | J15: Слышанное. Виденное. Передуманное. Пережитое | K15: 1930-1935 | L15: публицистика , нехудожественная | M15: мемуары | O15: Слышанное. Виденное. Передуманное. Пережитое | P15: 2011 | Q15: книга | R15: омонимия не снята | S15: На этот обед, даваемый министру, пользуясь тем, что мы были одни из распорядителей обеда, пригласили некоторых из своих знакомых, участвующих в нашем спиритическом кружке; один из них ― крупный инженер с Московско-Брестской железной дороги И.О. Ярковский, другой ― служащий в таможне Благоволин, но, быть может, фамилию его перепутал. [Николай Варенцов. Слышанное. Виденное. Передуманное. Пережитое (1930-1935)] [омонимия не снята] | T15: =RAND() -> 0.15241808275989743 | U15: пере | V15: Прошедшее | W15: ед.ч. м.р. | X15: NA | Y15: абстрактный предмет
C16: и братьев?.. Я все перезабыл, | D16: перепутал | E16: … | F16: Бакунина назвала их деревню и | G16: Н. А. Тучкова-Огарева. Воспоминания (1890) | H16: Н. А. Тучкова-Огарева | I16: 1829 | J16: Воспоминания | K16: 1890 | L16: публицистика , нехудожественная | M16: мемуары | O16: Н. А. Тучкова-Огарева. Воспоминания | Q16: книга | R16: омонимия не снята | S16: Вы были у них в деревне ― как зовут сестер и братьев?.. Я все перезабыл, перепутал… Бакунина назвала их деревню и вообще отвечала в точности на все вопросы. [Н. А. Тучкова-Огарева. Воспоминания (1890)] [омонимия не снята] | T16: =RAND() -> 4.5565468821609167E-2 | U16: пере | V16: Прошедшее | W16: ед.ч. м.р. | X16: человек | Y16: NA
C17: портреты китайцев повесить и вот | D17: перепутала | E17: … | G17: Н. И. Ильина. Иными глазами. Очерки шанхайской жизни (1946) | H17: Н. И. Ильина | I17: 1914 | J17: Иными глазами. Очерки шанхайской жизни | K17: 1946 | L17: публицистика, нехудожественная | M17: очерк | N17: искусство и культура, частная жизнь, политика и общественная жизнь, история | O17: Н. И. Ильина. Иными глазами. Шанхай, Эпоха, 1946 | P17: 1946 | Q17: книга | R17: омонимия не снята | S17: ― говорила Софья Павловна, моргая близорукими беспомощными глазами, ― я же хотела портреты китайцев повесить и вот перепутала… [Н. И. Ильина. Иными глазами. Очерки шанхайской жизни (1946)] [омонимия не снята] | T17: =RAND() -> 0.29644531625880277 | U17: пере | V17: Прошедшее | W17: ед.ч. ж.р. | X17: NA | Y17: NA
C18: военных делах и как дилетантка | D18: перепутала | F18: все слышанное. | G18: А. К. Шеллер-Михайлов. Лес рубят - щепки летят (1871) | H18: А. К. Шеллер-Михайлов | I18: 1838 | J18: Лес рубят - щепки летят | K18: 1871 | L18: художественная | M18: роман | O18: Шеллер-Михайлов А. К. Лес рубят - щепки летят | P18: 1984 | Q18: книга | R18: омонимия не снята | S18: Она, конечно, не умела передать этих известий с точностью специалиста в военных делах и как дилетантка перепутала все слышанное. [А. К. Шеллер-Михайлов. Лес рубят - щепки летят (1871)] [омонимия не снята] | T18: =RAND() -> 0.29163293024325765 | U18: пере | V18: Прошедшее | W18: ед.ч. ж.р. | X18: человек | Y18: NA
C19: настоящее время выяснилось, что покойная | D19: перепутала | F19: в завещании имя и фамилию | G19: В России (1912.02.25) // «Русское слово», 1912 | J19: В России | K19: 1912.02.25 | L19: публицистика , нехудожественная | M19: информационное сообщение | N19: администрация и управление, образование, религия, частная жизнь | O19: «Русское слово» | P19: 1912 | Q19: газета | R19: омонимия не снята | S19: В настоящее время выяснилось, что покойная перепутала в завещании имя и фамилию своего фаворита. [В России (1912.02.25) // «Русское слово», 1912] [омонимия не снята] | T19: =RAND() -> 0.82400293202874941 | U19: пере | V19: Прошедшее | W19: ед.ч. ж.р. | X19: человек | Y19: абстрактный предмет
C20: ― Ах, господи! | D20: Перепутала | E20: ! | F20: ― Господь тут ни при чем | G20: В. В. Вересаев. Сестры (1928-1931) | H20: В. В. Вересаев | I20: 1867 | J20: Сестры | K20: 1928-1931 | L20: художественная | M20: роман | Q20: книга | R20: омонимия не снята | S20: ― Ах, господи! Перепутала! ― Господь тут ни при чем, кстати, его даже и не существует. [В. В. Вересаев. Сестры (1928-1931)] [омонимия не снята] | T20: =RAND() -> 0.46070779322017896 | U20: пере | V20: Прошедшее | W20: ед.ч. ж.р. | X20: человек | Y20: NA
C21: нетрезвом виде, хотела опохмелиться, но | D21: перепутала | F21: бутылки и вместо водки, выпила | G21: неизвестный. Городские происшествия (1901.10.18) // «Новости дня», 1901 | H21: неизвестный | J21: Городские происшествия | K21: 1901.10.18 | L21: публицистика , нехудожественная | M21: информационное сообщение | N21: частная жизнь | O21: «Новости дня» | P21: 1901 | Q21: газета | R21: омонимия не снята | S21: 3-го октября проживающая в доме Медведева по Охотничьему переулку, московская мещанка Наталья Николаева Сергеева, находясь в нетрезвом виде, хотела опохмелиться, но перепутала бутылки и вместо водки, выпила русского скипидару, после чего заболела с признаками отравления. [неизвестный. Городские происшествия (1901.10.18) // «Новости дня», 1901] [омонимия не снята] | T21: =RAND() -> 0.76752534052146881 | U21: пере | V21: Прошедшее | W21: ед.ч. ж.р. | X21: человек | Y21: неодушевленный конкретный предмет
C22: опять пути-дороженьки… Ну, и | D22: перепутала | F22: все!.. Давно это было! | G22: В. И. Немирович-Данченко. Соловки (1874) | H22: В. И. Немирович-Данченко | I22: 1848 | J22: Соловки | K22: 1874 | L22: художественная | M22: очерк, цикл | O22: В. В. Немирович-Данченко. Сочинения. Том.2. Из книги паломничеств и путешествий | P22: 1996 | Q22: книга | R22: омонимия не снята | S22: Там опять пути-дороженьки… Ну, и перепутала все!.. Давно это было! [В. И. Немирович-Данченко. Соловки (1874)] [омонимия не снята] | T22: =RAND() -> 0.39424377136596733 | U22: пере | V22: Прошедшее | W22: ед.ч. ж.р. | X22: NA | Y22: NA
C23: Ах, Аксюта! Все мои дела | D23: перепутала | E23: ». | F23: И наконец Неплюев решил бесповоротно | G23: Е. А. Салиас. Крутоярская царевна (1893) | H23: Е. А. Салиас | I23: 1842 | J23: Крутоярская царевна | K23: 1893 | L23: художественная | M23: повесть | O23: Салиас Е. А. Сочинения в 2 тт. Т. 1 | P23: 1991 | Q23: книга | R23: омонимия не снята | S23: Ах, Аксюта! Все мои дела перепутала». И наконец Неплюев решил бесповоротно: [Е. А. Салиас. Крутоярская царевна (1893)] [омонимия не снята] | T23: =RAND() -> 0.40829368032775992 | U23: пере | V23: Прошедшее | W23: ед.ч. ж.р. | X23: человек | Y23: абстрактный предмет
C24: желтыми оскаленными зубами тревогой охватившей | D24: перепутали | F24: Мишкины мысли, больно ударило затекавшее | G24: А. С. Неверов. Ташкент ― город хлебный (1923) | H24: А. С. Неверов | I24: 1886 | J24: Ташкент ― город хлебный | K24: 1923 | L24: художественная | M24: повесть | O24: А. Неверов. Ташкент - город хлебный | P24: 1925 | Q24: книга | R24: омонимия не снята | S24: Тонкий посиневший нос, неподвижно разинутый рот с желтыми оскаленными зубами тревогой охватившей перепутали Мишкины мысли, больно ударило затекавшее сердце. [А. С. Неверов. Ташкент ― город хлебный (1923)] [омонимия не снята] | T24: =RAND() -> 0.65689801296382622 | U24: пере | V24: Прошедшее | W24: мн.ч. | X24: NA | Y24: абстрактный предмет
C25: он автор сегодняшней пьесы. ― Вы | D25: перепутали | E25: . | F25: Григоровича комедия только сейчас будет | G25: А. А. Нильский. Закулисная хроника. 1856 -- 1894 (1856-1894) | H25: А. А. Нильский | I25: 1840 | J25: Закулисная хроника. 1856 -- 1894 | K25: 1856-1894 | L25: публицистика, нехудожественная | M25: мемуары | Q25: книга | R25: омонимия не снята | S25: Автор пьесы… Ты ведь сам сказал, что он автор сегодняшней пьесы. ― Вы перепутали. Григоровича комедия только сейчас будет играться, а это Штеллер, автор «Ошибок молодости», которую только что мы сыграли… [А. А. Нильский. Закулисная хроника. 1856 -- 1894 (1856-1894)] [омонимия не снята] | T25: =RAND() -> 0.36606676128785343 | U25: пере | V25: Прошедшее | W25: мн.ч. | X25: человек
C26: черной дыры портала, и это | D26: перепутало | F26: все элементы его самочувствия? | G26: К. С. Станиславский. Работа актера над собой (1938) | H26: К. С. Станиславский | I26: 1863 | J26: Работа актера над собой | K26: 1938 | L26: учебно-научная , нехудожественная | M26: монография | N26: искусство и культура | O26: Работа актера над собой | P26: 1938 | Q26: книга | R26: омонимия не снята | S26: Может быть, артист испугался черной дыры портала, и это перепутало все элементы его самочувствия? [К. С. Станиславский. Работа актера над собой (1938)] [омонимия не снята] | T26: =RAND() -> 0.19020034498441363 | U26: пере | V26: Прошедшее | W26: ед.ч. ср.р. | X26: NA | Y26: абстрактный предмет

Sheet: tense_prefix
A3: Количество по полю TENSE | B3: Названия столбцов
A4: Названия строк | B4: Будущее | C4: Прошедшее | D4: Общий итог
A5: пере | B5: 2 | C5: 23 | D5: 25
A6: с | B6: 2 | C6: 23 | D6: 25
A7: Общий итог | B7: 4 | C7: 46 | D7: 50

Sheet: personnumber_prefix
A3: Количество по полю PERSONNUMBER | B3: Названия столбцов
A4: Названия строк | B4: 2л. ед.ч. | C4: 2л. мн.ч. | D4: 3л. ед.ч. | E4: ед.ч. ж.р. | F4: ед.ч. м.р. | G4: ед.ч. ср.р. | H4: мн.ч. | I4: Общий итог
A5: пере | B5: 2 | E5: 7 | F5: 13 | G5: 1 | H5: 2 | I5: 25
A6: с | C6: 1 | D6: 1 | E6: 3 | F6: 15 | H6: 5 | I6: 25
A7: Общий итог | B7: 2 | C7: 1 | D7: 1 | E7: 10 | F7: 28 | G7: 1 | H7: 7 | I7: 50

Sheet: personnumber_tense_prefix
B3: Названия столбцов
B4: Будущее | H4: Будущее Количество по полю PERSONNUMBER | I4: Будущее Количество по полю TENSE | J4: Прошедшее | R4: Прошедшее Количество по полю PERSONNUMBER | S4: Прошедшее Количество по полю TENSE | T4: Итог Количество по полю PERSONNUMBER | U4: Итог Количество по полю TENSE
B5: 2л. ед.ч. | D5: 2л. мн.ч. | F5: 3л. ед.ч. | J5: ед.ч. ж.р. | L5: ед.ч. м.р. | N5: ед.ч. ср.р. | P5: мн.ч.
A6: Названия строк | B6: Количество по полю PERSONNUMBER | C6: Количество по полю TENSE | D6: Количество по полю PERSONNUMBER | E6: Количество по полю TENSE | F6: Количество по полю PERSONNUMBER | G6: Количество по полю TENSE | J6: Количество по полю PERSONNUMBER | K6: Количество по полю TENSE | L6: Количество по полю PERSONNUMBER | M6: Количество по полю TENSE | N6: Количество по полю PERSONNUMBER | O6: Количество по полю TENSE | P6: Количество по полю PERSONNUMBER | Q6: Количество по полю TENSE
A7: пере | B7: 2 | C7: 2 | H7: 2 | I7: 2 | J7: 7 | K7: 7 | L7: 13 | M7: 13 | N7: 1 | O7: 1 | P7: 2 | Q7: 2 | R7: 23 | S7: 23 | T7: 25 | U7: 25
A8: с | D8: 1 | E8: 1 | F8: 1 | G8: 1 | H8: 2 | I8: 2 | J8: 3 | K8: 3 | L8: 15 | M8: 15 | P8: 5 | Q8: 5 | R8: 23 | S8: 23 | T8: 25 | U8: 25
A9: Общий итог | B9: 2 | C9: 2 | D9: 1 | E9: 1 | F9: 1 | G9: 1 | H9: 4 | I9: 4 | J9: 10 | K9: 10 | L9: 28 | M9: 28 | N9: 1 | O9: 1 | P9: 7 | Q9: 7 | R9: 46 | S9: 46 | T9: 50 | U9: 50

Sheet: participiant1_prefix
A3: Количество по полю PARTICIPANT1 | B3: Названия столбцов
A4: Названия строк | B4: NA | C4: абстрактный предмет | D4: дух | E4: неодушевленный конкретный предмет | F4: человек | G4: Общий итог
A5: пере | B5: 7 | F5: 18 | G5: 25
A6: с | B6: 4 | C6: 1 | D6: 1 | E6: 2 | F6: 17 | G6: 25
A7: Общий итог | B7: 11 | C7: 1 | D7: 1 | E7: 2 | F7: 35 | G7: 50

Sheet: participiant2_prefix
A3: Количество по полю PARTICIPANT2 | B3: Названия столбцов
A4: Названия строк | B4: NA | C4: абстрактный предмет | D4: животное | E4: неодушевленный конкретный предмет | F4: часть тела человека | G4: человек | H4: человека | I4: Общий итог
A5: пере | B5: 14 | C5: 8 | E5: 3 | I5: 25
A6: с | B6: 10 | C6: 3 | D6: 2 | F6: 1 | G6: 7 | H6: 2 | I6: 25
A7: Общий итог | B7: 24 | C7: 11 | D7: 2 | E7: 3 | F7: 1 | G7: 7 | H7: 2 | I7: 50

Sheet: created_prefix
A3: Количество по полю CREATED | B3: Названия столбцов
A4: Названия строк | B4: 1814 | C4: 1833 | D4: 1835 | E4: 1845 | F4: 1848 | G4: 1856-1894 | H4: 1863 | I4: 1868 | J4: 1871 | K4: 1874 | L4: 1882 | M4: 1883-1887 | N4: 1886 | O4: 1890 | P4: 1893 | Q4: 1896 | R4: 1900-1901 | S4: 1901.10.18 | T4: 1903 | U4: 1906 | V4: 1906-1907 | W4: 1912.02.25 | X4: 1913-1932 | Y4: 1914 | Z4: 1917 | AA4: 1917-1924 | AB4: 1918-1919 | AC4: 1920-1938 | AD4: 1920-1943 | AE4: 1922-1927 | AF4: 1923 | AG4: 1925 | AH4: 1927 | AI4: 1928 | AJ4: 1928-1931 | AK4: 1929 | AL4: 1930-1931 | AM4: 1930-1935 | AN4: 1931 | AO4: 1932 | AP4: 1934 | AQ4: 1936 | AR4: 1938 | AS4: 1940-1954 | AT4: 1940-1956 | AU4: 1945-1946 | AV4: 1946 | AW4: 1947-1953 | AX4: (пусто) | AY4: Общий итог
A5: пере | E5: 1 | F5: 1 | G5: 1 | J5: 1 | K5: 1 | L5: 1 | O5: 1 | P5: 1 | Q5: 1 | S5: 1 | U5: 1 | V5: 1 | W5: 1 | X5: 1 | Y5: 1 | Z5: 1 | AC5: 1 | AF5: 1 | AI5: 1 | AJ5: 1 | AK5: 1 | AM5: 1 | AP5: 1 | AR5: 1 | AV5: 1 | AY5: 25
A6: с | B6: 1 | C6: 1 | D6: 1 | H6: 1 | I6: 1 | M6: 1 | N6: 1 | R6: 1 | T6: 1 | AA6: 1 | AB6: 1 | AD6: 1 | AE6: 1 | AG6: 2 | AH6: 1 | AL6: 1 | AN6: 1 | AO6: 1 | AQ6: 1 | AS6: 1 | AT6: 1 | AU6: 1 | AV6: 1 | AW6: 1 | AY6: 25
A7: (пусто)
A8: Общий итог | B8: 1 | C8: 1 | D8: 1 | E8: 1 | F8: 1 | G8: 1 | H8: 1 | I8: 1 | J8: 1 | K8: 1 | L8: 1 | M8: 1 | N8: 1 | O8: 1 | P8: 1 | Q8: 1 | R8: 1 | S8: 1 | T8: 1 | U8: 1 | V8: 1 | W8: 1 | X8: 1 | Y8: 1 | Z8: 1 | AA8: 1 | AB8: 1 | AC8: 1 | AD8: 1 | AE8: 1 | AF8: 1 | AG8: 2 | AH8: 1 | AI8: 1 | AJ8: 1 | AK8: 1 | AL8: 1 | AM8: 1 | AN8: 1 | AO8: 1 | AP8: 1 | AQ8: 1 | AR8: 1 | AS8: 1 | AT8: 1 | AU8: 1 | AV8: 2 | AW8: 1 | AY8: 50